Style,Rank,Studio Name,Address,Neighborhood,Website URL,Description / Highlights,Price Range,Amenities
,,,,,,,,
Hatha Yoga,1,Center for Yoga LA,"230 ½ N Larchmont Blvd, Los Angeles, CA 90004",Larchmont Village,https://centerforyogala.com,"Classic Hatha practice emphasizing breath, alignment, and presence.",Not listed,Meditation; Changing Room; Restroom
Hatha Yoga,2,Silver Lake Yoga,"2810 ½ Glendale Blvd, Los Angeles, CA 90039",Silver Lake,https://www.silverlakeyoga.com,"Foundational classes in alignment, mindfulness, and balance.",$29 drop-in,Meditation; Props
Hatha Yoga,3,Red Diamond Yoga,"3500 Overland Ave Suite 210, Los Angeles, CA 90034",Palms / Culver City Adjacent,https://www.reddiamondyoga.com,Inclusive Hatha instruction for all levels with strong community support.,Not listed,Heated Room; Soundbath (events)
Hatha Yoga,4,Lotus Warrior Studio,"3701 Ocean View Blvd, Montrose, CA 91020",,https://www.lotuswarrior.com,"Gentle, meditative Hatha with strong energetic and therapeutic focus.",,
Hatha Yoga,5,Yoga Shala West,"11271 National Blvd, Suite B, Los Angeles, CA 90064",Sawtelle / West LA,http://yogashalawest.com,Hatha-rooted Mysore instruction with alignment and breath awareness.,Contribution-based (sliding),Meditation; Changing Room; Restroom
Hatha Yoga,6,Kinship Yoga,"5612 N Figueroa St, Los Angeles, CA 90042",,https://www.kinshipyoga.com,Accessible Hatha classes balancing effort and ease in a peaceful space.,,
Hatha Yoga,7,Liberation Yoga,"124 S La Brea Ave, Los Angeles, CA 90036",,https://www.liberationyoga.com,"Known for its grounding, slow-paced Hatha with breath and presence focus.",,