Style,Rank,Studio Name,Address,Neighborhood,Website URL,Description / Highlights,Price Range,Amenities
Kundalini Yoga,1.0,Golden Bridge Yoga,"719 S Los Angeles St, Los Angeles, CA 90014",Downtown LA (Fashion District),https://www.goldenbridgeyoga.com,Flagship Kundalini studio founded by Gurmukh; known worldwide for teacher training and devotion.,Not listed,Meditation; Restroom
Kundalini Yoga,2.0,Kundalini Yoga by the Sea,"1612 Ocean Park Blvd, Santa Monica, CA 90405",Santa Monica (Ocean Park),https://www.kundaliniyogabythesea.com,Authentic daily practice of Kundalini Yoga with sound healing and sadhana.,Not listed,Meditation; Restroom
Kundalini Yoga,3.0,Astro Gong Yoga,"1890 Marengo St, Los Angeles, CA 90033",Boyle Heights,https://www.astrogongyoga.com,"Sound-centered Kundalini studio with emphasis on vibration, healing, and cosmic energy.",Not listed,Meditation; Soundbath; Restroom
Kundalini Yoga,4.0,Kundalini LA,"2636 Huron St, Los Angeles, CA 90065",Frogtown / Elysian Valley,https://www.kundalinila.com,"Modern, accessible Kundalini classes with devotional energy and community events.",Not listed,Meditation; Restroom
Kundalini Yoga,5.0,Nine Treasures Yoga,"1840 N Highland Ave, Los Angeles, CA 90028",,https://www.ninetreasuresyoga.com,"Deep spiritual practice with gong baths, mantra, and breathwork.",,
Kundalini Yoga,6.0,RA MA Institute LA,"1729 21st St, Santa Monica, CA 90404",,https://ramayogainstitute.com,"Popular Westside studio for modern Kundalini lifestyle, events, and teacher training.",,
Kundalini Yoga,7.0,Master Inner Beauty Collective,"333 S Alameda St, Los Angeles, CA 90013",,https://www.masterinnerbeauty.com,"Small studio focused on energetic, feminine-centered Kundalini practices.",,
