Style,Rank,Studio Name,Address,Neighborhood,Website URL,Description / Highlights,Price Range,Amenities
Yin Yoga,1.0,Laughing Frog Yoga,"115 N Doheny Dr, Los Angeles, CA 90048",Beverly Grove / Beverly Hills Adjacent,https://laughingfrogyoga.com,Dedicated Yin classes with experienced teachers focused on deep release.,Not listed,Restroom
Yin Yoga,2.0,Silver Lake Yoga,"2810 ½ Glendale Blvd, Los Angeles, CA 90039",Silver Lake,https://www.silverlakeyoga.com,Longstanding community studio offering gentle and Yin-style classes.,$29 drop-in,Meditation; Props; Restroom
Yin Yoga,3.0,One Down Dog,"3176 Los Feliz Blvd, Los Angeles, CA 90039",Los Feliz / Atwater Village,https://onedowndog.com,Offers 'CHILL' classes grounded in Yin principles of stillness and depth.,Not listed,Changing Room; Restroom; Props
Yin Yoga,4.0,Center for Yoga LA,"230 ½ N Larchmont Blvd, Los Angeles, CA 90004",Larchmont Village,https://centerforyogala.com,"Blends mindful movement and Yin with breathwork in quiet, sacred space.",Not listed,Meditation; Changing Room; Restroom
Yin Yoga,5.0,Modo Yoga LA,"340 S La Brea Ave, Los Angeles, CA 90036",Mid-Wilshire / Hancock Park,https://modoyoga.com/los-angeles,"Heated Yin and meditation classes offered in sustainable, serene environment.",Not listed,Heated Room; Changing Room; Restroom; Mat Rental
Yin Yoga,6.0,Red Diamond Yoga,"3500 Overland Ave Suite 210, Los Angeles, CA 90034",Palms / Culver City Adjacent,https://www.reddiamondyoga.com,Yin classes offered alongside power and restorative options for balance.,Not listed,Heated Room; Soundbath
Yin Yoga,7.0,Astro Gong Yoga,"1890 Marengo St, Los Angeles, CA 90033",Boyle Heights,https://www.astrogongyoga.com,Unique Yin experiences paired with sound healing and cosmic stillness.,Not listed,Meditation; Soundbath; Restroom
